{
  "schemaVersion": 1,
  "slug": "spielzeug-unter-20-euro",
  "status": "approved",
  "publishReady": true,
  "primaryQuery": "spielzeug unter 20 euro",
  "searchIntent": "commercial",
  "targetAudience": "Eltern und Schenkende, die altersgerechte Spielideen mit einer harten Budgetgrenze suchen",
  "uniqueValue": "Acht nach Alter sortierte Ideen mit transparenter 20-Euro-Regel, Ausschlusskriterien und klarer Kennzeichnung als Recherche statt Produkttest",
  "reviewDueAt": "2026-10-13",
  "sources": [
    {
      "id": "eu-toy-safety",
      "url": "https://single-market-economy.ec.europa.eu/sectors/toys/toy-safety_en",
      "kind": "primary",
      "checkedAt": "2026-07-15"
    },
    {
      "id": "bioeg-play-1-3",
      "url": "https://www.kindergesundheit-info.de/themen/spielen/1-3-jahre/",
      "kind": "official",
      "checkedAt": "2026-07-15"
    },
    {
      "id": "bioeg-safety-1-3",
      "url": "https://www.kindergesundheit-info.de/themen/sicher-aufwachsen/1-3-jahre/",
      "kind": "official",
      "checkedAt": "2026-07-15"
    }
  ],
  "claims": [
    {
      "id": "ce-manufacturer-conformity",
      "type": "safety",
      "text": "Die CE-Kennzeichnung ist für Spielzeug im EU-Markt erforderlich und ist nicht automatisch eine unabhängige Laborbewertung.",
      "sourceIds": ["eu-toy-safety"],
      "approvedForPublish": true
    },
    {
      "id": "price-rule",
      "type": "commercial",
      "text": "Ein verlinktes Produkt gehört nur zur Auswahl, solange sein aktueller Händlerpreis ohne zusätzliche Pflichtkosten höchstens 20 Euro beträgt.",
      "sourceIds": [],
      "approvedForPublish": true
    },
    {
      "id": "no-own-test",
      "type": "editorial",
      "text": "Die Reihenfolge ist eine redaktionelle Einordnung nach Recherche und kein eigener vollständiger Produkttest.",
      "sourceIds": ["bioeg-play-1-3", "bioeg-safety-1-3"],
      "approvedForPublish": true
    }
  ],
  "humanApproval": {
    "required": true,
    "approvedBy": "Boris Nazarov (Projektinhaber)",
    "approvedAt": "2026-07-15",
    "notes": "Claims geprüft und für die Veröffentlichung freigegeben. Händlerpreise vor jedem Update stichprobenartig prüfen; Preisänderungen sind ausdrücklich möglich."
  }
}
